<?xml version="1.0" encoding="UTF-8"?>

<!ELEMENT ZVPGTZ_kurzusfelvetel (hallgato,kurzusok)>
<!ELEMENT hallgato (hnev,szulev,szak)>
<!ELEMENT kurzusok (kurzus*)>
<!ELEMENT kurzus (kurzusnev,kredit,hely,idopont+,(oktato|oraado))>

<!ATTLIST ZVPGTZ_kurzusfelvetel tanev CDATA #REQUIRED>
<!ATTLIST ZVPGTZ_kurzusfelvetel egyetem CDATA #REQUIRED>

<!ATTLIST szak evf CDATA #REQUIRED>

<!ATTLIST kurzus id ID #REQUIRED>
<!ATTLIST kurzus jovahagyas (igen | nem) "nem">
<!ATTLIST kurzus nyelv (német | angol | magyar) "magyar">

<!ELEMENT hnev (#PCDATA)>
<!ELEMENT szulev (#PCDATA)>
<!ELEMENT szak (#PCDATA)>

<!ELEMENT kurzusnev (#PCDATA)>
<!ELEMENT kredit (#PCDATA)>
<!ELEMENT hely (#PCDATA)>
<!ELEMENT idopont (#PCDATA)>

<!ELEMENT oraado (#PCDATA)>
<!ELEMENT oktato (#PCDATA)>
